{
  "signal_id": "SIG-20260316-0001",
  "contract_id": "BR-6.26",
  "timeframe": "15m",
  "strategy_version_id": "trend-breakout-v1",
  "mode": "paper",
  "side": "long",
  "entry_ref": 82.45,
  "stop_ref": 81.70,
  "target_ref": 83.95,
  "confidence": 0.76,
  "ts_decision": "2026-03-16T10:16:00Z",
  "indicator_context": {
    "dataset_version": "bars-whitelist-v1",
    "snapshot_id": "ICTX-20260316-0001"
  }
}
